,character,dialogue,neg,pos,neu,compound,tokens,words
1377,LUKE,Nothing.  I'm all right.,0.0,0.0,1.0,0.0,"['nothing', 'i', 'all', 'right']",0.030534351145038167
1378,LUKE,I've lost Artoo!,0.564,0.0,0.436,-0.3802,"['i', 'lost', 'artoo']",0.022900763358778626
1379,VADER,I have you now.,0.0,0.0,1.0,0.0,"['i', 'have', 'you', 'now']",0.030534351145038167
1382,HAN,"You're all clear, kid.",0.0,0.464,0.536,0.3818,"['you', 'all', 'clear', 'kid']",0.030534351145038167
1383,HAN,Now let's blow this thing and go home!,0.0,0.0,1.0,0.0,"['now', 'let', 'blow', 'this', 'thing', 'and', 'go', 'home']",0.061068702290076333
1384,HAN,"Great shot, kid.  That was one in a million.",0.0,0.369,0.631,0.6249,"['great', 'shot', 'kid', 'that', 'was', 'one', 'in', 'a', 'million']",0.06870229007633588
1385,BEN,"Remember, the Force will be with you... always.",0.0,0.0,1.0,0.0,"['remember', 'the', 'force', 'will', 'be', 'with', 'you', 'always']",0.061068702290076333
1386,LEIA,Luke!  Luke!  Luke!,0.0,0.0,1.0,0.0,"['luke', 'luke', 'luke']",0.022900763358778626
1387,HAN,Hey!  Hey!,0.0,0.0,1.0,0.0,"['hey', 'hey']",0.015267175572519083
1388,LUKE,I knew you'd come back!  I just knew it!,0.0,0.0,1.0,0.0,"['i', 'knew', 'you', 'come', 'back', 'i', 'just', 'knew', 'it']",0.06870229007633588
1389,HAN,"Well, I wasn't gonna let you get all the credit and take all the reward.",0.0,0.433,0.567,0.8126,"['well', 'i', 'was', 'gon', 'na', 'let', 'you', 'get', 'all', 'the', 'credit', 'and', 'take', 'all', 'the', 'reward']",0.12213740458015267
1390,LEIA,"Hey, I knew there was more to you than money.",0.0,0.0,1.0,0.0,"['hey', 'i', 'knew', 'there', 'was', 'more', 'to', 'you', 'than', 'money']",0.07633587786259542
1391,LUKE,"Oh, no!",0.714,0.0,0.286,-0.3595,"['oh', 'no']",0.015267175572519083
1392,THREEPIO,"Oh, my!  Artoo!  Can you hear me?  Say something!You can repair him, can't you?",0.0,0.0,1.0,0.0,"['oh', 'my', 'artoo', 'can', 'you', 'hear', 'me', 'say', 'something', 'you', 'can', 'repair', 'him', 'ca', 'you']",0.11450381679389313
1393,THREEPIO,"You must repair him!  Sir, if any of my circuits or gears will help, I'll gladly donate them.",0.0,0.252,0.748,0.6588,"['you', 'must', 'repair', 'him', 'sir', 'if', 'any', 'of', 'my', 'circuits', 'or', 'gears', 'will', 'help', 'i', 'gladly', 'donate', 'them']",0.13740458015267176
1394,LUKE,He'll be all right.,0.0,0.0,1.0,0.0,"['he', 'be', 'all', 'right']",0.030534351145038167
1395,VADER,"You may dispense with the pleasantries, Commander. I'm here to put you back on schedule.",0.0,0.141,0.859,0.3182,"['you', 'may', 'dispense', 'with', 'the', 'pleasantries', 'commander', 'i', 'here', 'to', 'put', 'you', 'back', 'on', 'schedule']",0.11450381679389313
1396,VADER,Perhaps I can find new ways to motivate them.,0.0,0.271,0.729,0.3818,"['perhaps', 'i', 'can', 'find', 'new', 'ways', 'to', 'motivate', 'them']",0.06870229007633588
1397,VADER,The Emperor does not share your optimistic appraisal of the situation.,0.3,0.0,0.7,-0.431,"['the', 'emperor', 'does', 'not', 'share', 'your', 'optimistic', 'appraisal', 'of', 'the', 'situation']",0.08396946564885496
1398,VADER,Then perhaps you can tell him when he arrives.,0.0,0.0,1.0,0.0,"['then', 'perhaps', 'you', 'can', 'tell', 'him', 'when', 'he', 'arrives']",0.06870229007633588
1399,VADER,"That is correct, Commander. And he is most displeased with your apparent lack of progress.",0.271,0.138,0.591,-0.4005,"['that', 'is', 'correct', 'commander', 'and', 'he', 'is', 'most', 'displeased', 'with', 'your', 'apparent', 'lack', 'of', 'progress']",0.11450381679389313
1400,VADER,"I hope so, Commander, for your sake. The Emperor is not as forgiving as I am.",0.139,0.168,0.693,0.1265,"['i', 'hope', 'so', 'commander', 'for', 'your', 'sake', 'the', 'emperor', 'is', 'not', 'as', 'forgiving', 'as', 'i', 'am']",0.12213740458015267
1401,THREEPIO,"Of course I'm worried. And you should be, too. Lando Calrissian and poor Chewbacca never returned from this awful place.",0.341,0.0,0.659,-0.8316,"['of', 'course', 'i', 'worried', 'and', 'you', 'should', 'be', 'too', 'lando', 'calrissian', 'and', 'poor', 'chewbacca', 'never', 'returned', 'from', 'this', 'awful', 'place']",0.15267175572519084
1402,THREEPIO,"Don't be so sure. If I told you half the things I've heard about this Jabba the Hutt, You'd probably short-circuit.",0.0,0.136,0.864,0.4572,"['do', 'be', 'so', 'sure', 'if', 'i', 'told', 'you', 'half', 'the', 'things', 'i', 'heard', 'about', 'this', 'jabba', 'the', 'hutt', 'you', 'probably']",0.15267175572519084
1403,THREEPIO,"Artoo, are you sure this is the right place? I better knock, I suppose.",0.0,0.342,0.658,0.6369,"['artoo', 'are', 'you', 'sure', 'this', 'is', 'the', 'right', 'place', 'i', 'better', 'knock', 'i', 'suppose']",0.10687022900763359
1404,THREEPIO,There doesn't seem to be anyone there. Let's go back and tell Master Luke.,0.0,0.0,1.0,0.0,"['there', 'does', 'seem', 'to', 'be', 'anyone', 'there', 'let', 'go', 'back', 'and', 'tell', 'master', 'luke']",0.10687022900763359
1405,THREEPIO,Goodness gracious me!,0.0,0.873,0.127,0.784,"['goodness', 'gracious', 'me']",0.022900763358778626
1406,THREEPIO,Artoo Detoowha bo Seethreepiowha ey toota odd mischka Jabba du Hutt.,0.187,0.0,0.813,-0.3182,"['artoo', 'detoowha', 'bo', 'seethreepiowha', 'ey', 'toota', 'odd', 'mischka', 'jabba', 'du', 'hutt']",0.08396946564885496
1407,THREEPIO,"I don't think they're going to let us in, Artoo. We'd better go.",0.0,0.209,0.791,0.4404,"['i', 'do', 'think', 'they', 'going', 'to', 'let', 'us', 'in', 'artoo', 'we', 'better', 'go']",0.09923664122137404
1408,THREEPIO,"Artoo, wait. Oh, dear! Artoo. Artoo, I really don't think we should rush into all this.",0.0,0.171,0.829,0.4389,"['artoo', 'wait', 'oh', 'dear', 'artoo', 'artoo', 'i', 'really', 'do', 'think', 'we', 'should', 'rush', 'into', 'all', 'this']",0.12213740458015267
1409,THREEPIO,"Oh, Artoo!  Artoo, wait for me!",0.0,0.0,1.0,0.0,"['oh', 'artoo', 'artoo', 'wait', 'for', 'me']",0.04580152671755725
1410,THREEPIO,"Just you deliver Master Luke's message and get us out of here. Oh my! Oh! Oh, no.",0.148,0.0,0.852,-0.4184,"['just', 'you', 'deliver', 'master', 'luke', 'message', 'and', 'get', 'us', 'out', 'of', 'here', 'oh', 'my', 'oh', 'oh', 'no']",0.1297709923664122
1411,THREEPIO,"Oh, my! Die Wanna Wauaga. We -- we bring a message to your master, Jabba the Hutt.",0.218,0.0,0.782,-0.636,"['oh', 'my', 'die', 'wan', 'na', 'wauaga', 'we', 'we', 'bring', 'a', 'message', 'to', 'your', 'master', 'jabba', 'the', 'hutt']",0.1297709923664122
1412,THREEPIO,"... and a gift.  Gift, what gift?",0.0,0.744,0.256,0.8271,"['and', 'a', 'gift', 'gift', 'what', 'gift']",0.04580152671755725
1413,THREEPIO,He says that our instructions are to give it only to Jabba himself.,0.0,0.0,1.0,0.0,"['he', 'says', 'that', 'our', 'instructions', 'are', 'to', 'give', 'it', 'only', 'to', 'jabba', 'himself']",0.09923664122137404
1414,THREEPIO,I'm terribly sorry. I'm afraid he's ever so stubborn about these sort of things.,0.433,0.0,0.567,-0.8122,"['i', 'terribly', 'sorry', 'i', 'afraid', 'he', 'ever', 'so', 'stubborn', 'about', 'these', 'sort', 'of', 'things']",0.10687022900763359
1415,THREEPIO,"Artoo, I have a bad feeling about this.",0.389,0.167,0.444,-0.4588,"['artoo', 'i', 'have', 'a', 'bad', 'feeling', 'about', 'this']",0.061068702290076333
1416,THREEPIO,Good morning.,0.0,0.744,0.256,0.4404,"['good', 'morning']",0.015267175572519083
1417,THREEPIO,"The message, Artoo, the message.",0.0,0.0,1.0,0.0,"['the', 'message', 'artoo', 'the', 'message']",0.03816793893129771
1418,LUKE,"Greetings, Exalted One. Allow me to introduce myself. I am Luke Skywalker, Jedi Knight and friend to Captain Solo. I know that you are powerful, mighty Jabba, and that your anger with Solo must be equally powerful. I seek an audience with Your Greatness to bargain for Solo's life.  With your wisdom, I'm sure that we can work out an arrangement which will be mutually beneficial and enable us to avoid any unpleasant confrontation. As a token of my goodwill, I present to you a gift: these two droids.",0.106,0.25,0.644,0.926,"['greetings', 'exalted', 'one', 'allow', 'me', 'to', 'introduce', 'myself', 'i', 'am', 'luke', 'skywalker', 'jedi', 'knight', 'and', 'friend', 'to', 'captain', 'solo', 'i', 'know', 'that', 'you', 'are', 'powerful', 'mighty', 'jabba', 'and', 'that', 'your', 'anger', 'with', 'solo', 'must', 'be', 'equally', 'powerful', 'i', 'seek', 'an', 'audience', 'with', 'your', 'greatness', 'to', 'bargain', 'for', 'solo', 'life', 'with', 'your', 'wisdom', 'i', 'sure', 'that', 'we', 'can', 'work', 'out', 'an', 'arrangement', 'which', 'will', 'be', 'mutually', 'beneficial', 'and', 'enable', 'us', 'to', 'avoid', 'any', 'unpleasant', 'confrontation', 'as', 'a', 'token', 'of', 'my', 'goodwill', 'i', 'present', 'to', 'you', 'a', 'gift', 'these', 'two', 'droids']",0.6793893129770993
1419,THREEPIO,What did he say?,0.0,0.0,1.0,0.0,"['what', 'did', 'he', 'say']",0.030534351145038167
1420,LUKE,... Both are hardworking and will serve you well.,0.0,0.208,0.792,0.2732,"['both', 'are', 'hardworking', 'and', 'will', 'serve', 'you', 'well']",0.061068702290076333
1421,THREEPIO,"This can't be! Artoo, you're playing the wrong message.",0.278,0.148,0.574,-0.3802,"['this', 'ca', 'be', 'artoo', 'you', 'playing', 'the', 'wrong', 'message']",0.06870229007633588
1422,THREEPIO,We're doomed.,0.808,0.0,0.192,-0.6369,"['we', 'doomed']",0.015267175572519083
1423,THREEPIO,"Artoo, look! Captain Solo. And he's still frozen in carbonite.",0.0,0.0,1.0,0.0,"['artoo', 'look', 'captain', 'solo', 'and', 'he', 'still', 'frozen', 'in', 'carbonite']",0.07633587786259542
1424,THREEPIO,What could possibly have come over Master Luke. Is it something I did? He never expressed any unhappiness with my work. Oh! Oh! Hold it! Ohh!,0.0,0.141,0.859,0.6052,"['what', 'could', 'possibly', 'have', 'come', 'over', 'master', 'luke', 'is', 'it', 'something', 'i', 'did', 'he', 'never', 'expressed', 'any', 'unhappiness', 'with', 'my', 'work', 'oh', 'oh', 'hold', 'it', 'ohh']",0.1984732824427481
1425,THREEPIO,"I am See-Threepio, human-cy...",0.0,0.0,1.0,0.0,"['i', 'am']",0.015267175572519083
1426,THREEPIO,"Oh. Well, yes.",0.0,0.828,0.172,0.5859,"['oh', 'well', 'yes']",0.022900763358778626
1427,THREEPIO,"I am fluent in over six million forms of communication, and can readily...",0.0,0.0,1.0,0.0,"['i', 'am', 'fluent', 'in', 'over', 'six', 'million', 'forms', 'of', 'communication', 'and', 'can', 'readily']",0.09923664122137404
1429,THREEPIO,"Artoo, don't leave me! Ohhh!",0.0,0.302,0.698,0.1857,"['artoo', 'do', 'leave', 'me', 'ohhh']",0.03816793893129771
1430,THREEPIO,"Oh, no! Chewbacca!",0.582,0.0,0.418,-0.4184,"['oh', 'no', 'chewbacca']",0.022900763358778626
1431,THREEPIO,"Oh, uh, yes, uh, I am here, Your Worshipfulness. Uh... yes!",0.0,0.542,0.458,0.807,"['oh', 'uh', 'yes', 'uh', 'i', 'am', 'here', 'your', 'worshipfulness', 'uh', 'yes']",0.08396946564885496
1432,THREEPIO,Oh. The illustrious Jabba bids you welcome and will gladly pay you the reward of twenty- five thousand.,0.057,0.371,0.571,0.8271,"['oh', 'the', 'illustrious', 'jabba', 'bids', 'you', 'welcome', 'and', 'will', 'gladly', 'pay', 'you', 'the', 'reward', 'of', 'five', 'thousand']",0.1297709923664122
1433,THREEPIO,"Uh, oh... but what, what did I say?  Uh, the mighty Jabba asks why he must pay fifty thousand.",0.086,0.0,0.914,-0.1531,"['uh', 'oh', 'but', 'what', 'what', 'did', 'i', 'say', 'uh', 'the', 'mighty', 'jabba', 'asks', 'why', 'he', 'must', 'pay', 'fifty', 'thousand']",0.1450381679389313
1434,THREEPIO,Because he's holding a thermal detonator.,0.0,0.0,1.0,0.0,"['because', 'he', 'holding', 'a', 'thermal', 'detonator']",0.04580152671755725
1435,THREEPIO,Jabba offers the sum of thirty-five. And I suggest you take it.,0.0,0.0,1.0,0.0,"['jabba', 'offers', 'the', 'sum', 'of', 'and', 'i', 'suggest', 'you', 'take', 'it']",0.08396946564885496
1436,THREEPIO,He agrees!,0.0,0.677,0.323,0.2714,"['he', 'agrees']",0.015267175572519083
1437,HAN,I can't see.,0.0,0.0,1.0,0.0,"['i', 'ca', 'see']",0.022900763358778626
1438,HAN,Where am I?,0.0,0.0,1.0,0.0,"['where', 'am', 'i']",0.022900763358778626
1439,HAN,Who are you?,0.0,0.0,1.0,0.0,"['who', 'are', 'you']",0.022900763358778626
1440,LEIA,Someone who loves you.,0.0,0.552,0.448,0.5719,"['someone', 'who', 'loves', 'you']",0.030534351145038167
1442,LEIA,I gotta get you out of here.,0.0,0.0,1.0,0.0,"['i', 'got', 'ta', 'get', 'you', 'out', 'of', 'here']",0.061068702290076333
1443,HAN,What's that? I know that laugh.,0.0,0.474,0.526,0.5574,"['what', 'that', 'i', 'know', 'that', 'laugh']",0.04580152671755725
1444,HAN,"Hey, Jabba. Look, Jabba, I was just on my way to pay you back, but I got a little sidetracked. It's not my fault.",0.052,0.125,0.823,0.3993,"['hey', 'jabba', 'look', 'jabba', 'i', 'was', 'just', 'on', 'my', 'way', 'to', 'pay', 'you', 'back', 'but', 'i', 'got', 'a', 'little', 'sidetracked', 'it', 'not', 'my', 'fault']",0.183206106870229
1446,HAN,Jabba... I'll pay you triple! You're throwing away a fortune here. Don't be a fool!,0.091,0.194,0.715,0.3798,"['jabba', 'i', 'pay', 'you', 'triple', 'you', 'throwing', 'away', 'a', 'fortune', 'here', 'do', 'be', 'a', 'fool']",0.11450381679389313
1447,LEIA,We have powerful friends. You're gonna regret this...,0.204,0.431,0.365,0.4767,"['we', 'have', 'powerful', 'friends', 'you', 'gon', 'na', 'regret', 'this']",0.06870229007633588
1449,THREEPIO,"Ohhh, I can't bear to watch.",0.0,0.0,1.0,0.0,"['ohhh', 'i', 'ca', 'bear', 'to', 'watch']",0.04580152671755725
1450,HAN,"Chewie? Chewie, is that you?",0.0,0.0,1.0,0.0,"['chewie', 'chewie', 'is', 'that', 'you']",0.03816793893129771
1451,HAN,Ah! Chew--Chewie!,0.0,0.0,1.0,0.0,"['ah', 'chew', 'chewie']",0.022900763358778626
1452,HAN,"Wait. I can't see, pal. What's goin' on?",0.0,0.0,1.0,0.0,"['wait', 'i', 'ca', 'see', 'pal', 'what', 'goin', 'on']",0.061068702290076333
1453,HAN,"Luke? Luke's crazy. He can't even take care of himself, much less rescue anybody.",0.264,0.158,0.578,-0.2549,"['luke', 'luke', 'crazy', 'he', 'ca', 'even', 'take', 'care', 'of', 'himself', 'much', 'less', 'rescue', 'anybody']",0.10687022900763359
1454,HAN,"A...Jedi Knight? I--I'm out of it for a little while, everybody gets delusions of grandeur.",0.0,0.207,0.793,0.5267,"['a', 'jedi', 'knight', 'i', 'i', 'out', 'of', 'it', 'for', 'a', 'little', 'while', 'everybody', 'gets', 'delusions', 'of', 'grandeur']",0.1297709923664122
1455,HAN,"I'm all right, pal. I'm all right.",0.0,0.0,1.0,0.0,"['i', 'all', 'right', 'pal', 'i', 'all', 'right']",0.05343511450381679
1456,LUKE,I must speak with Jabba.,0.0,0.0,1.0,0.0,"['i', 'must', 'speak', 'with', 'jabba']",0.03816793893129771
1457,LUKE,You will take me to Jabba now!,0.0,0.0,1.0,0.0,"['you', 'will', 'take', 'me', 'to', 'jabba', 'now']",0.05343511450381679
1458,LUKE,You serve your master well.,0.0,0.344,0.656,0.2732,"['you', 'serve', 'your', 'master', 'well']",0.03816793893129771
1459,LUKE,And you will be rewarded.,0.0,0.444,0.556,0.4939,"['and', 'you', 'will', 'be', 'rewarded']",0.03816793893129771
1460,THREEPIO,At last! Master Luke's come to rescue me.,0.0,0.339,0.661,0.5562,"['at', 'last', 'master', 'luke', 'come', 'to', 'rescue', 'me']",0.061068702290076333
1461,LUKE,I must be allowed to speak.,0.0,0.0,1.0,0.0,"['i', 'must', 'be', 'allowed', 'to', 'speak']",0.04580152671755725
1462,LUKE,You will bring Captain Solo and the Wookiee to me.,0.0,0.0,1.0,0.0,"['you', 'will', 'bring', 'captain', 'solo', 'and', 'the', 'wookiee', 'to', 'me']",0.07633587786259542
1463,LUKE,"Nevertheless, I'm taking Captain Solo and his friends. You can either profit by this... or be destroyed! It's your choice. But I warn you not to underestimate my powers.",0.111,0.199,0.69,0.4449,"['nevertheless', 'i', 'taking', 'captain', 'solo', 'and', 'his', 'friends', 'you', 'can', 'either', 'profit', 'by', 'this', 'or', 'be', 'destroyed', 'it', 'your', 'choice', 'but', 'i', 'warn', 'you', 'not', 'to', 'underestimate', 'my', 'powers']",0.22137404580152673
1464,THREEPIO,"Master Luke, you're standing on...",0.0,0.0,1.0,0.0,"['master', 'luke', 'you', 'standing', 'on']",0.03816793893129771
1465,THREEPIO,"Oh, no! The Rancor!",0.481,0.0,0.519,-0.4184,"['oh', 'no', 'the', 'rancor']",0.030534351145038167
1468,LUKE,Are you all right?,0.0,0.0,1.0,0.0,"['are', 'you', 'all', 'right']",0.030534351145038167
1469,HAN,"Fine. Together again, huh?",0.0,0.375,0.625,0.2023,"['fine', 'together', 'again', 'huh']",0.030534351145038167
1470,LUKE,Wouldn't miss it.,0.0,0.419,0.581,0.1139,"['would', 'miss', 'it']",0.022900763358778626
1471,HAN,How are we doing?,0.0,0.0,1.0,0.0,"['how', 'are', 'we', 'doing']",0.030534351145038167
1472,LUKE,The same as always.,0.0,0.0,1.0,0.0,"['the', 'same', 'as', 'always']",0.030534351145038167
1473,HAN,"That bad, huh? Where's Leia?",0.491,0.0,0.509,-0.594,"['that', 'bad', 'huh', 'where', 'leia']",0.03816793893129771
1474,LEIA,I'm here.,0.0,0.0,1.0,0.0,"['i', 'here']",0.015267175572519083
1475,THREEPIO,"Oh, dear. His High Exaltedness, the great Jabba the Hutt, has decreed that you are to be terminated immediately.",0.0,0.283,0.717,0.7717,"['oh', 'dear', 'his', 'high', 'exaltedness', 'the', 'great', 'jabba', 'the', 'hutt', 'has', 'decreed', 'that', 'you', 'are', 'to', 'be', 'terminated', 'immediately']",0.1450381679389313
1476,HAN,"Good, I hate long waits.",0.43,0.337,0.233,-0.2023,"['good', 'i', 'hate', 'long', 'waits']",0.03816793893129771
1477,THREEPIO,"You will therefore be taken to the Dune Sea and cast into the pit of Carkoon, the nesting place of the all-powerful Sarlacc.",0.0,0.0,1.0,0.0,"['you', 'will', 'therefore', 'be', 'taken', 'to', 'the', 'dune', 'sea', 'and', 'cast', 'into', 'the', 'pit', 'of', 'carkoon', 'the', 'nesting', 'place', 'of', 'the', 'sarlacc']",0.16793893129770993
1478,HAN,Doesn't sound so bad.,0.6,0.0,0.4,-0.6696,"['does', 'sound', 'so', 'bad']",0.030534351145038167
1479,THREEPIO,"In his belly, you will find a new definition of pain and suffering, as you are slowly digested over a thousand years.",0.262,0.0,0.738,-0.7506,"['in', 'his', 'belly', 'you', 'will', 'find', 'a', 'new', 'definition', 'of', 'pain', 'and', 'suffering', 'as', 'you', 'are', 'slowly', 'digested', 'over', 'a', 'thousand', 'years']",0.16793893129770993
1480,HAN,"On second thought, let's pass on that, huh?",0.0,0.0,1.0,0.0,"['on', 'second', 'thought', 'let', 'pass', 'on', 'that', 'huh']",0.061068702290076333
1481,LUKE,"You should have bargained, Jabba. That's the last mistake you'll ever make.",0.179,0.0,0.821,-0.34,"['you', 'should', 'have', 'bargained', 'jabba', 'that', 'the', 'last', 'mistake', 'you', 'ever', 'make']",0.0916030534351145
1482,HAN,"I think my eyes are getting better. Instead of a big dark blur, I see a big light blur.",0.0,0.172,0.828,0.4404,"['i', 'think', 'my', 'eyes', 'are', 'getting', 'better', 'instead', 'of', 'a', 'big', 'dark', 'blur', 'i', 'see', 'a', 'big', 'light', 'blur']",0.1450381679389313
1483,LUKE,"There's nothing to see. I used to live here, you know.",0.0,0.0,1.0,0.0,"['there', 'nothing', 'to', 'see', 'i', 'used', 'to', 'live', 'here', 'you', 'know']",0.08396946564885496
1484,HAN,"You're gonna die here, you know. Convenient.",0.394,0.0,0.606,-0.5994,"['you', 'gon', 'na', 'die', 'here', 'you', 'know', 'convenient']",0.061068702290076333
1485,LUKE,Just stick close to Chewie and Lando. I've taken care of everything.,0.0,0.225,0.775,0.4939,"['just', 'stick', 'close', 'to', 'chewie', 'and', 'lando', 'i', 'taken', 'care', 'of', 'everything']",0.0916030534351145
1486,HAN,Oh... great!,0.0,0.815,0.185,0.6588,"['oh', 'great']",0.015267175572519083
1487,THREEPIO,"Oh, I'm terribly sor... Artoo! What are you doing here?",0.302,0.0,0.698,-0.5983,"['oh', 'i', 'terribly', 'sor', 'artoo', 'what', 'are', 'you', 'doing', 'here']",0.07633587786259542
1488,THREEPIO,"Well, I can see you're serving drinks, but this place is dangerous. They're going to execute Master Luke and, if we're not careful, us too!",0.213,0.054,0.733,-0.6765,"['well', 'i', 'can', 'see', 'you', 'serving', 'drinks', 'but', 'this', 'place', 'is', 'dangerous', 'they', 'going', 'to', 'execute', 'master', 'luke', 'and', 'if', 'we', 'not', 'careful', 'us', 'too']",0.19083969465648856
1489,THREEPIO,Hmm.  I wish I had your confidence.,0.0,0.667,0.333,0.7184,"['hmm', 'i', 'wish', 'i', 'had', 'your', 'confidence']",0.05343511450381679
1490,THREEPIO,"Victims of the almighty Sarlacc: His Excellency hopes that you will die honorably. But should any of you wish to beg for mercy, the great Jabba the Hutt will now listen to your pleas.",0.084,0.384,0.532,0.9403,"['victims', 'of', 'the', 'almighty', 'sarlacc', 'his', 'excellency', 'hopes', 'that', 'you', 'will', 'die', 'honorably', 'but', 'should', 'any', 'of', 'you', 'wish', 'to', 'beg', 'for', 'mercy', 'the', 'great', 'jabba', 'the', 'hutt', 'will', 'now', 'listen', 'to', 'your', 'pleas']",0.2595419847328244
1491,HAN,"Threepio, you tell that slimy piece of... worm-ridden filth he'll get no such pleasure from us. Right?",0.105,0.177,0.718,0.3612,"['threepio', 'you', 'tell', 'that', 'slimy', 'piece', 'of', 'filth', 'he', 'get', 'no', 'such', 'pleasure', 'from', 'us', 'right']",0.12213740458015267
1492,LUKE,Jabba! This is your last chance. Free us or die.,0.236,0.339,0.424,0.1759,"['jabba', 'this', 'is', 'your', 'last', 'chance', 'free', 'us', 'or', 'die']",0.07633587786259542
1493,LUKE,"Easy, Chewie.",0.0,0.744,0.256,0.4404,"['easy', 'chewie']",0.015267175572519083
1494,LANDO,Whoa! Whoa! Help!,0.0,0.641,0.359,0.5538,"['whoa', 'whoa', 'help']",0.022900763358778626
1495,HAN,"Chewie, you okay? Where is he?",0.0,0.311,0.689,0.3094,"['chewie', 'you', 'okay', 'where', 'is', 'he']",0.04580152671755725
1496,HAN,"I'm okay, pal.",0.0,0.487,0.513,0.2263,"['i', 'okay', 'pal']",0.022900763358778626
1497,LANDO,Han! Chewie?,0.0,0.0,1.0,0.0,"['han', 'chewie']",0.015267175572519083
1499,HAN,Boba Fett?! Boba Fett?! Where?,0.0,0.0,1.0,0.0,"['boba', 'fett', 'boba', 'fett', 'where']",0.03816793893129771
1500,HAN,"Lando, grab it!",0.0,0.0,1.0,0.0,"['lando', 'grab', 'it']",0.022900763358778626
1501,LANDO,Lower it!,0.714,0.0,0.286,-0.3595,"['lower', 'it']",0.015267175572519083
1502,HAN,I'm trying!,0.0,0.0,1.0,0.0,"['i', 'trying']",0.015267175572519083
1503,HAN,"Whoa! Whoa! Grab me, Chewie! I'm slipping.",0.0,0.0,1.0,0.0,"['whoa', 'whoa', 'grab', 'me', 'chewie', 'i', 'slipping']",0.05343511450381679
1504,HAN,Grab it! L--Lando. Grab!,0.0,0.0,1.0,0.0,"['grab', 'it', 'l', 'lando', 'grab']",0.03816793893129771
1505,HAN,Grab it! Almost... You almost got it!,0.0,0.0,1.0,0.0,"['grab', 'it', 'almost', 'you', 'almost', 'got', 'it']",0.05343511450381679
1506,LANDO,Hold it! Whoa!,0.0,0.0,1.0,0.0,"['hold', 'it', 'whoa']",0.022900763358778626
1507,HAN,"Gently now. All... all right. Now easy, easy. Hold me, Chewie.",0.0,0.524,0.476,0.8316,"['gently', 'now', 'all', 'all', 'right', 'now', 'easy', 'easy', 'hold', 'me', 'chewie']",0.08396946564885496
1508,HAN,"Chewie! Chewie, give me the gun. Don't move, Lando.",0.252,0.0,0.748,-0.4003,"['chewie', 'chewie', 'give', 'me', 'the', 'gun', 'do', 'move', 'lando']",0.06870229007633588
1509,LANDO,"No, wait! I thought you were blind!",0.578,0.0,0.422,-0.6688,"['no', 'wait', 'i', 'thought', 'you', 'were', 'blind']",0.05343511450381679
1510,HAN,It's all right. Trust me. Don't move.,0.0,0.355,0.645,0.5106,"['it', 'all', 'right', 'trust', 'me', 'do', 'move']",0.05343511450381679
1511,LANDO,All right! A little higher! Just a little higher!,0.0,0.0,1.0,0.0,"['all', 'right', 'a', 'little', 'higher', 'just', 'a', 'little', 'higher']",0.06870229007633588
1512,HAN,"Chewie, Pull us up! Come on! Okay... up, Chewie, up!",0.0,0.0,1.0,0.0,"['chewie', 'pull', 'us', 'up', 'come', 'on', 'okay', 'up', 'chewie', 'up']",0.07633587786259542
1513,LEIA,Come on. We gotta get out of here quick.,0.0,0.0,1.0,0.0,"['come', 'on', 'we', 'got', 'ta', 'get', 'out', 'of', 'here', 'quick']",0.07633587786259542
1514,THREEPIO,"Not my eyes! Artoo, help! Quickly, Artoo. Oh! Ohhh! You beast!",0.0,0.279,0.721,0.5951,"['not', 'my', 'eyes', 'artoo', 'help', 'quickly', 'artoo', 'oh', 'ohhh', 'you', 'beast']",0.08396946564885496
1515,LUKE,Get the gun! Point it at the deck!,0.299,0.0,0.701,-0.4559,"['get', 'the', 'gun', 'point', 'it', 'at', 'the', 'deck']",0.061068702290076333
1516,LUKE,Point it at the deck!,0.0,0.0,1.0,0.0,"['point', 'it', 'at', 'the', 'deck']",0.03816793893129771
1517,THREEPIO,"Artoo, where are we going? I couldn't possibly jump.",0.0,0.0,1.0,0.0,"['artoo', 'where', 'are', 'we', 'going', 'i', 'could', 'possibly', 'jump']",0.06870229007633588
1518,LUKE,Come on!,0.0,0.0,1.0,0.0,"['come', 'on']",0.015267175572519083
1519,LUKE,Let's go! And don't forget the droids.,0.0,0.246,0.754,0.2401,"['let', 'go', 'and', 'do', 'forget', 'the', 'droids']",0.05343511450381679
1520,LANDO,We're on our way.,0.0,0.0,1.0,0.0,"['we', 'on', 'our', 'way']",0.030534351145038167
1521,HAN,I don't know. All I can see is a lot of blowing sand!,0.0,0.0,1.0,0.0,"['i', 'do', 'know', 'all', 'i', 'can', 'see', 'is', 'a', 'lot', 'of', 'blowing', 'sand']",0.09923664122137404
1522,LEIA,That's all any of us can see.,0.0,0.0,1.0,0.0,"['that', 'all', 'any', 'of', 'us', 'can', 'see']",0.05343511450381679
1523,HAN,Then I guess I'm getting better.,0.0,0.42,0.58,0.4404,"['then', 'i', 'guess', 'i', 'getting', 'better']",0.04580152671755725
1524,HAN,"I've got to hand it to you, kid, you were pretty good out there.",0.0,0.458,0.542,0.8519,"['i', 'got', 'to', 'hand', 'it', 'to', 'you', 'kid', 'you', 'were', 'pretty', 'good', 'out', 'there']",0.10687022900763359
1525,LUKE,I had a lot of help. Think nothing of it.,0.0,0.278,0.722,0.4019,"['i', 'had', 'a', 'lot', 'of', 'help', 'think', 'nothing', 'of', 'it']",0.07633587786259542
