,character,dialogue,neg,pos,neu,compound,tokens,words
0,LUKE,"Echo Three to Echo Seven. Han, old buddy, do you  read me?",0.0,0.0,1.0,0.0,"['echo', 'three', 'to', 'echo', 'seven', 'han', 'old', 'buddy', 'do', 'you', 'read', 'me']",0.0916030534351145
1,HAN,"Loud and clear, kid. What's up?",0.0,0.342,0.658,0.3818,"['loud', 'and', 'clear', 'kid', 'what', 'up']",0.04580152671755725
2,LUKE,"Well, I finished my circle. I don't pick up any  life readings.",0.0,0.189,0.811,0.2732,"['well', 'i', 'finished', 'my', 'circle', 'i', 'do', 'pick', 'up', 'any', 'life', 'readings']",0.0916030534351145
3,HAN,There isn't enough life on this ice cube to fill a  space cruiser. The sensors are placed. I'm going back.,0.0,0.0,1.0,0.0,"['there', 'is', 'enough', 'life', 'on', 'this', 'ice', 'cube', 'to', 'fill', 'a', 'space', 'cruiser', 'the', 'sensors', 'are', 'placed', 'i', 'going', 'back']",0.15267175572519084
4,LUKE,Right. I'll see you shortly. There's a meteorite  that hit the ground near here. I want to check it out. It won't take long.,0.0,0.058,0.942,0.0772,"['right', 'i', 'see', 'you', 'shortly', 'there', 'a', 'meteorite', 'that', 'hit', 'the', 'ground', 'near', 'here', 'i', 'want', 'to', 'check', 'it', 'out', 'it', 'wo', 'take', 'long']",0.183206106870229
5,LUKE,"Hey, steady girl. What's the matter? You smell something?",0.0,0.154,0.846,0.1179,"['hey', 'steady', 'girl', 'what', 'the', 'matter', 'you', 'smell', 'something']",0.06870229007633588
8,HAN,"All right, don't lose your temper. I'll come right back and give  you a hand.",0.0,0.415,0.585,0.7776,"['all', 'right', 'do', 'lose', 'your', 'temper', 'i', 'come', 'right', 'back', 'and', 'give', 'you', 'a', 'hand']",0.11450381679389313
9,HAN,"No sign of life out there, General. The sensors are in place.  You'll know if anything comes around.",0.115,0.0,0.885,-0.296,"['no', 'sign', 'of', 'life', 'out', 'there', 'general', 'the', 'sensors', 'are', 'in', 'place', 'you', 'know', 'if', 'anything', 'comes', 'around']",0.13740458015267176
10,HAN,No. He's checking out a meteorite that hit near him.,0.216,0.0,0.784,-0.296,"['no', 'he', 'checking', 'out', 'a', 'meteorite', 'that', 'hit', 'near', 'him']",0.07633587786259542
11,HAN,"General, I've got to leave. I can't stay anymore.",0.146,0.0,0.854,-0.0516,"['general', 'i', 'got', 'to', 'leave', 'i', 'ca', 'stay', 'anymore']",0.06870229007633588
12,HAN,"Well, there's a price on my head. If I don't pay off Jabba the  Hut, I'm a dead man.",0.208,0.164,0.628,-0.4412,"['well', 'there', 'a', 'price', 'on', 'my', 'head', 'if', 'i', 'do', 'pay', 'off', 'jabba', 'the', 'hut', 'i', 'a', 'dead', 'man']",0.1450381679389313
13,HAN,"Thank you, General.",0.0,0.556,0.444,0.3612,"['thank', 'you', 'general']",0.022900763358778626
14,HAN,"Well, Your Highness, I guess this is it.",0.0,0.259,0.741,0.2732,"['well', 'your', 'highness', 'i', 'guess', 'this', 'is', 'it']",0.061068702290076333
15,LEIA,That's right.,0.0,0.0,1.0,0.0,"['that', 'right']",0.015267175572519083
16,HAN,"Well, don't get all mushy on me. So long, Princess.",0.0,0.189,0.811,0.2732,"['well', 'do', 'get', 'all', 'mushy', 'on', 'me', 'so', 'long', 'princess']",0.07633587786259542
18,HAN,"Yes, Your Highnessness?",0.0,0.574,0.426,0.4019,"['yes', 'your', 'highnessness']",0.022900763358778626
19,LEIA,I thought you decided to stay.,0.0,0.0,1.0,0.0,"['i', 'thought', 'you', 'decided', 'to', 'stay']",0.04580152671755725
20,HAN,"Well, the bounty hunter we ran into on Ord Mantell changed my  mind.",0.0,0.149,0.851,0.2732,"['well', 'the', 'bounty', 'hunter', 'we', 'ran', 'into', 'on', 'ord', 'mantell', 'changed', 'my', 'mind']",0.09923664122137404
21,LEIA,"Han, we need you!",0.0,0.0,1.0,0.0,"['han', 'we', 'need', 'you']",0.030534351145038167
24,HAN,"Oh, what about you need?",0.0,0.0,1.0,0.0,"['oh', 'what', 'about', 'you', 'need']",0.03816793893129771
25,LEIA,I need? I don't know what you're talking about.,0.0,0.0,1.0,0.0,"['i', 'need', 'i', 'do', 'know', 'what', 'you', 'talking', 'about']",0.06870229007633588
26,HAN,You probably don't.,0.0,0.0,1.0,0.0,"['you', 'probably', 'do']",0.022900763358778626
27,LEIA,And what precisely am I supposed to know?,0.0,0.0,1.0,0.0,"['and', 'what', 'precisely', 'am', 'i', 'supposed', 'to', 'know']",0.061068702290076333
28,HAN,Come on! You want me to stay because of the way you feel about  me.,0.0,0.102,0.898,0.1511,"['come', 'on', 'you', 'want', 'me', 'to', 'stay', 'because', 'of', 'the', 'way', 'you', 'feel', 'about', 'me']",0.11450381679389313
29,LEIA,Yes. You're a great help to us. You're a natural leader...,0.0,0.706,0.294,0.9001,"['yes', 'you', 'a', 'great', 'help', 'to', 'us', 'you', 'a', 'natural', 'leader']",0.08396946564885496
30,HAN,No! That's not it. Come on. Aahhh -- uh huh! Come on.,0.202,0.0,0.798,-0.4184,"['no', 'that', 'not', 'it', 'come', 'on', 'aahhh', 'uh', 'huh', 'come', 'on']",0.08396946564885496
31,LEIA,You're imagining things.,0.0,0.0,1.0,0.0,"['you', 'imagining', 'things']",0.022900763358778626
32,HAN,Am I? Then why are you following me? Afraid I was going to leave  without giving you a goodbye kiss?,0.175,0.13,0.695,0.2741,"['am', 'i', 'then', 'why', 'are', 'you', 'following', 'me', 'afraid', 'i', 'was', 'going', 'to', 'leave', 'without', 'giving', 'you', 'a', 'goodbye', 'kiss']",0.15267175572519084
33,LEIA,I'd just as soon kiss a Wookiee.,0.0,0.359,0.641,0.4215,"['i', 'just', 'as', 'soon', 'kiss', 'a', 'wookiee']",0.05343511450381679
34,HAN,I can arrange that. You could use a good kiss!,0.0,0.5,0.5,0.7177,"['i', 'can', 'arrange', 'that', 'you', 'could', 'use', 'a', 'good', 'kiss']",0.07633587786259542
35,THREEPIO,Don't try to blame me. I didn't ask you to turn on the  thermal heater. I merely commented that it was freezing in the princess's chamber. But it's supposed to be freezing. How are we going to dry out all her clothes? I really don't know.,0.063,0.034,0.903,-0.0726,"['do', 'try', 'to', 'blame', 'me', 'i', 'did', 'ask', 'you', 'to', 'turn', 'on', 'the', 'thermal', 'heater', 'i', 'merely', 'commented', 'that', 'it', 'was', 'freezing', 'in', 'the', 'princess', 'chamber', 'but', 'it', 'supposed', 'to', 'be', 'freezing', 'how', 'are', 'we', 'going', 'to', 'dry', 'out', 'all', 'her', 'clothes', 'i', 'really', 'do', 'know']",0.3511450381679389
36,THREEPIO,"Oh, switch off.",0.0,0.0,1.0,0.0,"['oh', 'switch', 'off']",0.022900763358778626
37,HAN,Why do you take this apart now? I'm trying to get us  out of here and you pull both of these.,0.0,0.0,1.0,0.0,"['why', 'do', 'you', 'take', 'this', 'apart', 'now', 'i', 'trying', 'to', 'get', 'us', 'out', 'of', 'here', 'and', 'you', 'pull', 'both', 'of', 'these']",0.16030534351145037
38,THREEPIO,"Excuse me, sir.",0.0,0.394,0.606,0.0772,"['excuse', 'me', 'sir']",0.022900763358778626
39,HAN,Put them back together right now.,0.0,0.0,1.0,0.0,"['put', 'them', 'back', 'together', 'right', 'now']",0.04580152671755725
40,THREEPIO,"Might I have a word with you, please?",0.0,0.315,0.685,0.3182,"['might', 'i', 'have', 'a', 'word', 'with', 'you', 'please']",0.061068702290076333
41,HAN,What do you want?,0.0,0.302,0.698,0.0772,"['what', 'do', 'you', 'want']",0.030534351145038167
42,THREEPIO,"Well, it's Princess Leia, sir. She's been trying to get you  on the communicator.",0.0,0.139,0.861,0.2732,"['well', 'it', 'princess', 'leia', 'sir', 'she', 'been', 'trying', 'to', 'get', 'you', 'on', 'the', 'communicator']",0.10687022900763359
43,HAN,I turned it off. I don't want to talk to her.,0.133,0.0,0.867,-0.0572,"['i', 'turned', 'it', 'off', 'i', 'do', 'want', 'to', 'talk', 'to', 'her']",0.08396946564885496
44,THREEPIO,"Oh. Well, Princess Leia is wondering about Master Luke. He  hasn't come back yet. She doesn't know where he is.",0.0,0.1,0.9,0.2732,"['oh', 'well', 'princess', 'leia', 'is', 'wondering', 'about', 'master', 'luke', 'he', 'has', 'come', 'back', 'yet', 'she', 'does', 'know', 'where', 'he', 'is']",0.15267175572519084
45,HAN,I don't know where he is.,0.0,0.0,1.0,0.0,"['i', 'do', 'know', 'where', 'he', 'is']",0.04580152671755725
46,THREEPIO,Nobody knows where he is.,0.0,0.0,1.0,0.0,"['nobody', 'knows', 'where', 'he', 'is']",0.03816793893129771
47,HAN,"What do you mean, \nobody knows\?",0.0,0.0,1.0,0.0,"['what', 'do', 'you', 'mean']",0.030534351145038167
48,THREEPIO,"Well, uh, you see...",0.0,0.412,0.588,0.2732,"['well', 'uh', 'you', 'see']",0.030534351145038167
49,HAN,Deck Officer. Deck Officer!,0.0,0.0,1.0,0.0,"['deck', 'officer', 'deck', 'officer']",0.030534351145038167
50,THREEPIO,"Excuse me, sir. Might I inqu-...",0.0,0.245,0.755,0.0772,"['excuse', 'me', 'sir', 'might', 'i']",0.03816793893129771
51,HAN,Do you know where Commander Skywalker is?,0.0,0.0,1.0,0.0,"['do', 'you', 'know', 'where', 'commander', 'skywalker', 'is']",0.05343511450381679
52,HAN,It's possible? Why don't you go find out? It's getting dark out  there.,0.0,0.0,1.0,0.0,"['it', 'possible', 'why', 'do', 'you', 'go', 'find', 'out', 'it', 'getting', 'dark', 'out', 'there']",0.09923664122137404
53,THREEPIO,"Excuse me, sir. Might I inquire what's going on?",0.0,0.157,0.843,0.0772,"['excuse', 'me', 'sir', 'might', 'i', 'inquire', 'what', 'going', 'on']",0.06870229007633588
54,HAN,Why not?,0.0,0.0,1.0,0.0,"['why', 'not']",0.015267175572519083
55,THREEPIO,"Impossible man. Come along, Artoo, lets find Princess Leia.  Between ourselves, I think Master Luke is in considerable danger.",0.167,0.0,0.833,-0.5267,"['impossible', 'man', 'come', 'along', 'artoo', 'lets', 'find', 'princess', 'leia', 'between', 'ourselves', 'i', 'think', 'master', 'luke', 'is', 'in', 'considerable', 'danger']",0.1450381679389313
56,HAN,Not likely. Are the speeders ready?,0.0,0.333,0.667,0.3612,"['not', 'likely', 'are', 'the', 'speeders', 'ready']",0.04580152671755725
57,HAN,Then we'll have to go out on Tauntauns.,0.0,0.0,1.0,0.0,"['then', 'we', 'have', 'to', 'go', 'out', 'on', 'tauntauns']",0.061068702290076333
58,HAN,That's right. And my friends out in it.,0.0,0.307,0.693,0.4767,"['that', 'right', 'and', 'my', 'friends', 'out', 'in', 'it']",0.061068702290076333
59,HAN,Then I'll see you in hell!,0.495,0.0,0.505,-0.7088,"['then', 'i', 'see', 'you', 'in', 'hell']",0.04580152671755725
60,THREEPIO,"You must come along now, Artoo. There's really nothing more  we can do. And my joints are freezing up.",0.072,0.0,0.928,-0.1027,"['you', 'must', 'come', 'along', 'now', 'artoo', 'there', 'really', 'nothing', 'more', 'we', 'can', 'do', 'and', 'my', 'joints', 'are', 'freezing', 'up']",0.1450381679389313
61,THREEPIO,"Don't say thing like that! Of course we'll see Master Luke  again. He'll be quite all right, you'll see.  Stupid little short-circuit. He'll be quite all right.",0.188,0.0,0.812,-0.7005,"['do', 'say', 'thing', 'like', 'that', 'of', 'course', 'we', 'see', 'master', 'luke', 'again', 'he', 'be', 'quite', 'all', 'right', 'you', 'see', 'stupid', 'little', 'he', 'be', 'quite', 'all', 'right']",0.1984732824427481
62,THREEPIO,"Mistress Leia, Artoo says he's been quite unable to pick up  any signals, although he does admit that his own range is far too weak to abandon all hope.",0.163,0.132,0.704,-0.2732,"['mistress', 'leia', 'artoo', 'says', 'he', 'been', 'quite', 'unable', 'to', 'pick', 'up', 'any', 'signals', 'although', 'he', 'does', 'admit', 'that', 'his', 'own', 'range', 'is', 'far', 'too', 'weak', 'to', 'abandon', 'all', 'hope']",0.22137404580152673
63,THREEPIO,Artoo says the chances of survival are seven hundred  seventy-five...to one.,0.0,0.153,0.847,0.2023,"['artoo', 'says', 'the', 'chances', 'of', 'survival', 'are', 'seven', 'hundred', 'to', 'one']",0.08396946564885496
64,THREEPIO,"Actually, Artoo has been known to make mistakes...from time  to time. Oh, dear, oh, dear. Don't worry about Master Luke. I'm sure he'll be all right. He's quite clever, you know...for a human being.",0.0,0.32,0.68,0.9042,"['actually', 'artoo', 'has', 'been', 'known', 'to', 'make', 'mistakes', 'from', 'time', 'to', 'time', 'oh', 'dear', 'oh', 'dear', 'do', 'worry', 'about', 'master', 'luke', 'i', 'sure', 'he', 'be', 'all', 'right', 'he', 'quite', 'clever', 'you', 'know', 'for', 'a', 'human', 'being']",0.2748091603053435
65,BEN,Luke...Luke.,0.0,0.0,1.0,0.0,"['luke', 'luke']",0.015267175572519083
67,BEN,You will go to the Dagobah system.,0.0,0.0,1.0,0.0,"['you', 'will', 'go', 'to', 'the', 'dagobah', 'system']",0.05343511450381679
68,LUKE,Dagobah system?,0.0,0.0,1.0,0.0,"['dagobah', 'system']",0.015267175572519083
69,BEN,"There you will learn from Yoda, the Jedi Master who instructed  me.",0.0,0.0,1.0,0.0,"['there', 'you', 'will', 'learn', 'from', 'yoda', 'the', 'jedi', 'master', 'who', 'instructed', 'me']",0.0916030534351145
70,LUKE,Ben...Ben.,0.0,0.0,1.0,0.0,"['ben', 'ben']",0.015267175572519083
71,HAN,"Luke! Luke! Don't do this, Luke. Come on, give me a sign here.",0.0,0.0,1.0,0.0,"['luke', 'luke', 'do', 'do', 'this', 'luke', 'come', 'on', 'give', 'me', 'a', 'sign', 'here']",0.09923664122137404
72,HAN,Not much time.,0.0,0.0,1.0,0.0,"['not', 'much', 'time']",0.022900763358778626
73,LUKE,Ben...Ben...,0.0,0.0,1.0,0.0,"['ben', 'ben']",0.015267175572519083
74,HAN,"Hang on, kid.",0.0,0.0,1.0,0.0,"['hang', 'on', 'kid']",0.022900763358778626
75,LUKE,Dagobah system...,0.0,0.0,1.0,0.0,"['dagobah', 'system']",0.015267175572519083
78,HAN,"This may smell bad, kid...",0.467,0.0,0.533,-0.5423,"['this', 'may', 'smell', 'bad', 'kid']",0.03816793893129771
80,HAN,...but it will keep you warm...til I get the shelter built.   Ooh...I thought they smelled bad on the outside!,0.182,0.0,0.818,-0.5848,"['but', 'it', 'will', 'keep', 'you', 'warm', 'til', 'i', 'get', 'the', 'shelter', 'built', 'ooh', 'i', 'thought', 'they', 'smelled', 'bad', 'on', 'the', 'outside']",0.16030534351145037
81,HAN,Good morning. Nice of you guys to  drop by.,0.152,0.413,0.435,0.5574,"['good', 'morning', 'nice', 'of', 'you', 'guys', 'to', 'drop', 'by']",0.06870229007633588
82,THREEPIO,"Master Luke, sir, it's good to see you fully functional  again.",0.0,0.225,0.775,0.4404,"['master', 'luke', 'sir', 'it', 'good', 'to', 'see', 'you', 'fully', 'functional', 'again']",0.08396946564885496
83,THREEPIO,"Artoo expresses his relief, also.",0.0,0.437,0.563,0.4767,"['artoo', 'expresses', 'his', 'relief', 'also']",0.03816793893129771
84,HAN,"How are you feeling, kid? You don't look so bad to me. In fact,  you look strong enough to pull the ears off a Gundark.",0.148,0.158,0.693,-0.1757,"['how', 'are', 'you', 'feeling', 'kid', 'you', 'do', 'look', 'so', 'bad', 'to', 'me', 'in', 'fact', 'you', 'look', 'strong', 'enough', 'to', 'pull', 'the', 'ears', 'off', 'a', 'gundark']",0.19083969465648856
85,LUKE,Thanks to you.,0.0,0.592,0.408,0.4404,"['thanks', 'to', 'you']",0.022900763358778626
86,HAN,"That's two you owe me, junior.",0.0,0.0,1.0,0.0,"['that', 'two', 'you', 'owe', 'me', 'junior']",0.04580152671755725
87,HAN,"Well your Worship, looks like you managed to keep me around for a  little while longer.",0.0,0.362,0.638,0.7003,"['well', 'your', 'worship', 'looks', 'like', 'you', 'managed', 'to', 'keep', 'me', 'around', 'for', 'a', 'little', 'while', 'longer']",0.12213740458015267
88,LEIA,I had nothing to do with it. General Rieekan thinks  it's dangerous for any ships to leave the system until we've activated the energy shield.,0.157,0.077,0.766,-0.296,"['i', 'had', 'nothing', 'to', 'do', 'with', 'it', 'general', 'rieekan', 'thinks', 'it', 'dangerous', 'for', 'any', 'ships', 'to', 'leave', 'the', 'system', 'until', 'we', 'activated', 'the', 'energy', 'shield']",0.19083969465648856
89,HAN,That's a good story. I think you just can't bear to let a  gorgeous guy like me out of your sight.,0.0,0.385,0.615,0.8555,"['that', 'a', 'good', 'story', 'i', 'think', 'you', 'just', 'ca', 'bear', 'to', 'let', 'a', 'gorgeous', 'guy', 'like', 'me', 'out', 'of', 'your', 'sight']",0.16030534351145037
90,LEIA,"I don't know where you get you delusions, laser brain.",0.0,0.0,1.0,0.0,"['i', 'do', 'know', 'where', 'you', 'get', 'you', 'delusions', 'laser', 'brain']",0.07633587786259542
91,HAN,"Laugh it up, fuzz ball. But you didn't see us alone in the south  passage.",0.0,0.253,0.747,0.5283,"['laugh', 'it', 'up', 'fuzz', 'ball', 'but', 'you', 'did', 'see', 'us', 'alone', 'in', 'the', 'south', 'passage']",0.11450381679389313
92,HAN,She expressed her true feelings for me.,0.0,0.318,0.682,0.4215,"['she', 'expressed', 'her', 'true', 'feelings', 'for', 'me']",0.05343511450381679
93,LEIA,"My...! Why, you stuck up,...half-witted,...scruffy-looking...  nerf-herder!",0.341,0.0,0.659,-0.3786,"['my', 'why', 'you', 'stuck', 'up']",0.03816793893129771
94,HAN,"Who's scruffy-looking?  I must have hit her pretty close  to the mark to get her all riled up like that, huh, kid?",0.0,0.242,0.758,0.7236,"['who', 'i', 'must', 'have', 'hit', 'her', 'pretty', 'close', 'to', 'the', 'mark', 'to', 'get', 'her', 'all', 'riled', 'up', 'like', 'that', 'huh', 'kid']",0.16030534351145037
95,LEIA,"Why, I guess you don't know everything about women yet?",0.0,0.0,1.0,0.0,"['why', 'i', 'guess', 'you', 'do', 'know', 'everything', 'about', 'women', 'yet']",0.07633587786259542
96,HAN,Take it easy.,0.0,0.592,0.408,0.4404,"['take', 'it', 'easy']",0.022900763358778626
97,THREEPIO,"Excuse us, please.",0.0,0.783,0.217,0.3818,"['excuse', 'us', 'please']",0.022900763358778626
98,LEIA,Then it couldn't be one of those creatures that attacked Luke.,0.231,0.0,0.769,-0.4588,"['then', 'it', 'could', 'be', 'one', 'of', 'those', 'creatures', 'that', 'attacked', 'luke']",0.08396946564885496
99,HAN,"It could be a speeder, one of ours.",0.0,0.0,1.0,0.0,"['it', 'could', 'be', 'a', 'speeder', 'one', 'of', 'ours']",0.061068702290076333
100,THREEPIO,"Sir, I am fluent in six million forms of communication. This  signal is not used by the Alliance. It could be an Imperial code.",0.0,0.0,1.0,0.0,"['sir', 'i', 'am', 'fluent', 'in', 'six', 'million', 'forms', 'of', 'communication', 'this', 'signal', 'is', 'not', 'used', 'by', 'the', 'alliance', 'it', 'could', 'be', 'an', 'imperial', 'code']",0.183206106870229
101,HAN,"It isn't friendly, whatever it is. Come on, Chewie, let's check  it out.",0.18,0.0,0.82,-0.3875,"['it', 'is', 'friendly', 'whatever', 'it', 'is', 'come', 'on', 'chewie', 'let', 'check', 'it', 'out']",0.09923664122137404
102,HAN,Afraid there's not much left.,0.0,0.0,1.0,0.0,"['afraid', 'there', 'not', 'much', 'left']",0.03816793893129771
103,LEIA,What was it?,0.0,0.0,1.0,0.0,"['what', 'was', 'it']",0.022900763358778626
104,HAN,Droid of some kind. I didn't hit it that hard. It  must have had a self-destruct.,0.083,0.202,0.714,0.4588,"['droid', 'of', 'some', 'kind', 'i', 'did', 'hit', 'it', 'that', 'hard', 'it', 'must', 'have', 'had', 'a']",0.11450381679389313
105,LEIA,An Imperial probe droid.,0.0,0.0,1.0,0.0,"['an', 'imperial', 'probe', 'droid']",0.030534351145038167
106,HAN,It's a good bet the Empire knows we're here.,0.0,0.293,0.707,0.4404,"['it', 'a', 'good', 'bet', 'the', 'empire', 'knows', 'we', 'here']",0.06870229007633588
107,VADER,You found something?,0.0,0.0,1.0,0.0,"['you', 'found', 'something']",0.022900763358778626
108,VADER,That's it. The  Rebels are there.,0.265,0.0,0.735,-0.2023,"['that', 'it', 'the', 'rebels', 'are', 'there']",0.04580152671755725
109,VADER,"That is the system. And I'm sure Skywalker is with them. Set  your course for the Hoth system. General Veers, prepare you men.",0.0,0.095,0.905,0.3182,"['that', 'is', 'the', 'system', 'and', 'i', 'sure', 'skywalker', 'is', 'with', 'them', 'set', 'your', 'course', 'for', 'the', 'hoth', 'system', 'general', 'veers', 'prepare', 'you', 'men']",0.17557251908396945
110,HAN,"Okay, that's it. Try it...Off! Turn it  off! Turn it off! Off!",0.0,0.218,0.782,0.471,"['okay', 'that', 'it', 'try', 'it', 'off', 'turn', 'it', 'off', 'turn', 'it', 'off', 'off']",0.09923664122137404
111,LUKE,"Well, forget the heavy equipment. There's plenty of time to get  the smaller modules on the transports.",0.1,0.111,0.789,0.0516,"['well', 'forget', 'the', 'heavy', 'equipment', 'there', 'plenty', 'of', 'time', 'to', 'get', 'the', 'smaller', 'modules', 'on', 'the', 'transports']",0.1297709923664122
113,LUKE,"Chewie, take care of yourself, okay?",0.0,0.56,0.44,0.6249,"['chewie', 'take', 'care', 'of', 'yourself', 'okay']",0.04580152671755725
114,HAN,"Hi, kid.  There's got to be a reason for it. Check it  at the other end. Wait a second.  You all right?",0.0,0.0,1.0,0.0,"['hi', 'kid', 'there', 'got', 'to', 'be', 'a', 'reason', 'for', 'it', 'check', 'it', 'at', 'the', 'other', 'end', 'wait', 'a', 'second', 'you', 'all', 'right']",0.16793893129770993
116,HAN,Be careful.,0.0,0.615,0.385,0.1531,"['be', 'careful']",0.015267175572519083
117,LUKE,"You, too.",0.0,0.0,1.0,0.0,"['you', 'too']",0.015267175572519083
118,VADER,"What is it, General?",0.0,0.0,1.0,0.0,"['what', 'is', 'it', 'general']",0.030534351145038167
119,VADER,The Rebels are alerted to our presence. Admiral Ozzel  came out of light-speed too close to the system.,0.09,0.114,0.796,0.128,"['the', 'rebels', 'are', 'alerted', 'to', 'our', 'presence', 'admiral', 'ozzel', 'came', 'out', 'of', 'too', 'close', 'to', 'the', 'system']",0.1297709923664122
120,VADER,"He is as clumsy as he is stupid. General, prepare your troops  for a surface attack.",0.333,0.0,0.667,-0.7579,"['he', 'is', 'as', 'clumsy', 'as', 'he', 'is', 'stupid', 'general', 'prepare', 'your', 'troops', 'for', 'a', 'surface', 'attack']",0.12213740458015267
121,VADER,"You have failed me for the last time, Admiral. Captain Piett.",0.226,0.158,0.616,-0.25,"['you', 'have', 'failed', 'me', 'for', 'the', 'last', 'time', 'admiral', 'captain', 'piett']",0.08396946564885496
122,VADER,"Make ready to land out troops beyond the energy shield and  deploy the fleet so that nothing gets off that system. You are in command now, Admiral Piett.",0.0,0.216,0.784,0.7096,"['make', 'ready', 'to', 'land', 'out', 'troops', 'beyond', 'the', 'energy', 'shield', 'and', 'deploy', 'the', 'fleet', 'so', 'that', 'nothing', 'gets', 'off', 'that', 'system', 'you', 'are', 'in', 'command', 'now', 'admiral', 'piett']",0.21374045801526717
123,LEIA,"All troop carriers will assemble at the north entrance. The  heavy transport ships will leave as soon as they're loaded. Only two fighter escorts per ship. The energy shield can only be opened for a short time, so you'll have to stay very close to your transports.",0.025,0.077,0.898,0.3612,"['all', 'troop', 'carriers', 'will', 'assemble', 'at', 'the', 'north', 'entrance', 'the', 'heavy', 'transport', 'ships', 'will', 'leave', 'as', 'soon', 'as', 'they', 'loaded', 'only', 'two', 'fighter', 'escorts', 'per', 'ship', 'the', 'energy', 'shield', 'can', 'only', 'be', 'opened', 'for', 'a', 'short', 'time', 'so', 'you', 'have', 'to', 'stay', 'very', 'close', 'to', 'your', 'transports']",0.35877862595419846
124,LEIA,"The ion cannon will fire several shots to make sure that any  enemy ships will be out of your flight path. When you've gotten past the energy shield, proceed directly to the rendezvous point. Understood?",0.143,0.107,0.751,-0.3612,"['the', 'ion', 'cannon', 'will', 'fire', 'several', 'shots', 'to', 'make', 'sure', 'that', 'any', 'enemy', 'ships', 'will', 'be', 'out', 'of', 'your', 'flight', 'path', 'when', 'you', 'gotten', 'past', 'the', 'energy', 'shield', 'proceed', 'directly', 'to', 'the', 'rendezvous', 'point', 'understood']",0.26717557251908397
125,LEIA,Good luck.,0.0,1.0,0.0,0.7096,"['good', 'luck']",0.015267175572519083
126,LUKE,"Just like new, Dack. How about you?",0.0,0.294,0.706,0.3612,"['just', 'like', 'new', 'dack', 'how', 'about', 'you']",0.05343511450381679
127,LUKE,I know what you mean.,0.0,0.0,1.0,0.0,"['i', 'know', 'what', 'you', 'mean']",0.03816793893129771
128,LUKE,Echo station Five-Seven. We're on our way.,0.0,0.0,1.0,0.0,"['echo', 'station', 'we', 'on', 'our', 'way']",0.04580152671755725
129,LUKE,"All right, boys, keep tight now.",0.0,0.0,1.0,0.0,"['all', 'right', 'boys', 'keep', 'tight', 'now']",0.04580152671755725
130,LUKE,"Steady, Dack. Attack pattern delta. Go now!",0.361,0.0,0.639,-0.5255,"['steady', 'dack', 'attack', 'pattern', 'delta', 'go', 'now']",0.05343511450381679
131,LUKE,"All right, I'm coming in.",0.0,0.0,1.0,0.0,"['all', 'right', 'i', 'coming', 'in']",0.03816793893129771
132,LUKE,"Hobbie, you still with me?",0.0,0.0,1.0,0.0,"['hobbie', 'you', 'still', 'with', 'me']",0.03816793893129771
133,LUKE,That armor's too strong for blasters.,0.0,0.398,0.602,0.5106,"['that', 'armor', 'too', 'strong', 'for', 'blasters']",0.04580152671755725
134,LUKE,"Rouge Group, use your harpoons and tow cables. Go  for the legs. It might be our only chance of stopping them.  All right, stand by, Dack.",0.058,0.072,0.87,0.1027,"['rouge', 'group', 'use', 'your', 'harpoons', 'and', 'tow', 'cables', 'go', 'for', 'the', 'legs', 'it', 'might', 'be', 'our', 'only', 'chance', 'of', 'stopping', 'them', 'all', 'right', 'stand', 'by', 'dack']",0.1984732824427481
135,LUKE,"Just hang on. Hang on, Dack. Get ready to fire that tow cable.",0.151,0.157,0.692,0.0258,"['just', 'hang', 'on', 'hang', 'on', 'dack', 'get', 'ready', 'to', 'fire', 'that', 'tow', 'cable']",0.09923664122137404
136,LUKE,Dack? Dack!,0.0,0.0,1.0,0.0,"['dack', 'dack']",0.015267175572519083
137,LUKE,Rouge Three.,0.0,0.0,1.0,0.0,"['rouge', 'three']",0.015267175572519083
138,LUKE,"Wedge, I've lost my gunner. You'll have to make  this shot. I'll cover for you. Set your harpoon. Follow me on the next pass.",0.091,0.0,0.909,-0.3182,"['wedge', 'i', 'lost', 'my', 'gunner', 'you', 'have', 'to', 'make', 'this', 'shot', 'i', 'cover', 'for', 'you', 'set', 'your', 'harpoon', 'follow', 'me', 'on', 'the', 'next', 'pass']",0.183206106870229
139,LUKE,"Steady, Rouge Two",0.0,0.0,1.0,0.0,"['steady', 'rouge', 'two']",0.022900763358778626
140,LUKE,"I see it, Wedge. Good work.",0.0,0.42,0.58,0.4404,"['i', 'see', 'it', 'wedge', 'good', 'work']",0.04580152671755725
141,LEIA,"It's risky, but we can't hold out much longer. We have no  choice.",0.276,0.0,0.724,-0.4939,"['it', 'risky', 'but', 'we', 'ca', 'hold', 'out', 'much', 'longer', 'we', 'have', 'no', 'choice']",0.09923664122137404
