,character,dialogue,neg,pos,neu,compound,tokens,words
587,VADER,He's all yours bounty hunter. Reset the chamber for Skywalker.,0.0,0.0,1.0,0.0,"['he', 'all', 'yours', 'bounty', 'hunter', 'reset', 'the', 'chamber', 'for', 'skywalker']",0.07633587786259542
588,VADER,"Good. See to it that he finds his way here. Calrissian, take  the princess and the Wookiee to my ship.",0.0,0.132,0.868,0.4404,"['good', 'see', 'to', 'it', 'that', 'he', 'finds', 'his', 'way', 'here', 'calrissian', 'take', 'the', 'princess', 'and', 'the', 'wookiee', 'to', 'my', 'ship']",0.15267175572519084
589,LANDO,You said they'd be left in the city under my supervision.,0.0,0.0,1.0,0.0,"['you', 'said', 'they', 'be', 'left', 'in', 'the', 'city', 'under', 'my', 'supervision']",0.08396946564885496
590,VADER,I am altering the deal. Pray I don't alter it any further.,0.0,0.204,0.796,0.3182,"['i', 'am', 'altering', 'the', 'deal', 'pray', 'i', 'do', 'alter', 'it', 'any', 'further']",0.0916030534351145
591,LEIA,"Luke! Luke, don't -- it's a trap! It's a trap!",0.0,0.444,0.556,0.5859,"['luke', 'luke', 'do', 'it', 'a', 'trap', 'it', 'a', 'trap']",0.06870229007633588
592,VADER,"The Force is with you, young Skywalker. But you are not a Jedi  yet.",0.0,0.0,1.0,0.0,"['the', 'force', 'is', 'with', 'you', 'young', 'skywalker', 'but', 'you', 'are', 'not', 'a', 'jedi', 'yet']",0.10687022900763359
593,LANDO,Well done. Hold them in the security tower -- and keep it  quiet. Move.,0.0,0.273,0.727,0.5423,"['well', 'done', 'hold', 'them', 'in', 'the', 'security', 'tower', 'and', 'keep', 'it', 'quiet', 'move']",0.09923664122137404
594,LEIA,What do you think you're doing?,0.0,0.0,1.0,0.0,"['what', 'do', 'you', 'think', 'you', 'doing']",0.04580152671755725
595,LANDO,We're getting out of here.,0.0,0.0,1.0,0.0,"['we', 'getting', 'out', 'of', 'here']",0.03816793893129771
596,THREEPIO,I knew all along it had to be a mistake.,0.255,0.0,0.745,-0.34,"['i', 'knew', 'all', 'along', 'it', 'had', 'to', 'be', 'a', 'mistake']",0.07633587786259542
597,LEIA,Do you think that after what you did to Han we're going to trust  you?,0.0,0.191,0.809,0.5106,"['do', 'you', 'think', 'that', 'after', 'what', 'you', 'did', 'to', 'han', 'we', 'going', 'to', 'trust', 'you']",0.11450381679389313
598,LANDO,I had no choice...,0.524,0.0,0.476,-0.296,"['i', 'had', 'no', 'choice']",0.030534351145038167
599,THREEPIO,"What are you doing? Trust him, trust him!",0.0,0.535,0.465,0.784,"['what', 'are', 'you', 'doing', 'trust', 'him', 'trust', 'him']",0.061068702290076333
600,LEIA,"Oh, so we understand, don't we, Chewie? He had no choice.",0.18,0.0,0.82,-0.296,"['oh', 'so', 'we', 'understand', 'do', 'we', 'chewie', 'he', 'had', 'no', 'choice']",0.08396946564885496
601,LANDO,I'm just trying to help...,0.0,0.0,1.0,0.0,"['i', 'just', 'trying', 'to', 'help']",0.03816793893129771
602,LEIA,We don't need any of your help.,0.0,0.31,0.69,0.4019,"['we', 'do', 'need', 'any', 'of', 'your', 'help']",0.05343511450381679
605,THREEPIO,It sounds like Han.,0.0,0.455,0.545,0.3612,"['it', 'sounds', 'like', 'han']",0.030534351145038167
606,LANDO,"There's still a chance to save Han...I mean, at the East  Platform...",0.0,0.366,0.634,0.6369,"['there', 'still', 'a', 'chance', 'to', 'save', 'han', 'i', 'mean', 'at', 'the', 'east', 'platform']",0.09923664122137404
608,THREEPIO,"I'm terribly sorry about all this. After all,  he's only a Wookiee.",0.353,0.0,0.647,-0.5994,"['i', 'terribly', 'sorry', 'about', 'all', 'this', 'after', 'all', 'he', 'only', 'a', 'wookiee']",0.0916030534351145
609,THREEPIO,Artoo! Artoo! Where have you been?,0.0,0.0,1.0,0.0,"['artoo', 'artoo', 'where', 'have', 'you', 'been']",0.04580152671755725
610,THREEPIO,"Turn around, you wooly...!  Hurry, hurry! We're  trying to save Han from the bounty hunter!",0.0,0.225,0.775,0.6219,"['turn', 'around', 'you', 'wooly', 'hurry', 'hurry', 'we', 'trying', 'to', 'save', 'han', 'from', 'the', 'bounty', 'hunter']",0.11450381679389313
611,THREEPIO,"Well, at least your still in one piece! Look what happened  to me!",0.0,0.183,0.817,0.3987,"['well', 'at', 'least', 'your', 'still', 'in', 'one', 'piece', 'look', 'what', 'happened', 'to', 'me']",0.09923664122137404
612,THREEPIO,"Oh, no! Chewie, they're behind you!",0.358,0.0,0.642,-0.4184,"['oh', 'no', 'chewie', 'they', 'behind', 'you']",0.04580152671755725
613,VADER,"You have learned much, young one.",0.0,0.0,1.0,0.0,"['you', 'have', 'learned', 'much', 'young', 'one']",0.04580152671755725
614,LUKE,You'll find I'm full of surprises.,0.0,0.275,0.725,0.2263,"['you', 'find', 'i', 'full', 'of', 'surprises']",0.04580152671755725
615,VADER,"Your destiny lies with me, Skywalker. Obi-Wan knew this to be  true.",0.179,0.179,0.641,0.0,"['your', 'destiny', 'lies', 'with', 'me', 'skywalker', 'knew', 'this', 'to', 'be', 'true']",0.08396946564885496
617,VADER,All to easy. Perhaps you are not as strong as the Emperor  thought.,0.163,0.175,0.663,0.0511,"['all', 'to', 'easy', 'perhaps', 'you', 'are', 'not', 'as', 'strong', 'as', 'the', 'emperor', 'thought']",0.09923664122137404
618,VADER,Impressive...most impressive.,0.0,0.767,0.233,0.5106,"['impressive', 'most', 'impressive']",0.022900763358778626
619,VADER,Obi-Wan has taught you well. You have controlled your fear...  now release your anger.,0.208,0.118,0.674,-0.3818,"['has', 'taught', 'you', 'well', 'you', 'have', 'controlled', 'your', 'fear', 'now', 'release', 'your', 'anger']",0.09923664122137404
620,VADER,Only your hatred can destroy me.,0.658,0.0,0.342,-0.8271,"['only', 'your', 'hatred', 'can', 'destroy', 'me']",0.04580152671755725
621,LANDO,The security codes has been changed!,0.0,0.35,0.65,0.4003,"['the', 'security', 'codes', 'has', 'been', 'changed']",0.04580152671755725
622,THREEPIO,"Artoo, you can tell the computer to override the security  system.",0.0,0.194,0.806,0.34,"['artoo', 'you', 'can', 'tell', 'the', 'computer', 'to', 'override', 'the', 'security', 'system']",0.08396946564885496
623,LANDO,Attention! This is Lando Calrissian. The Empire has takes  control of the city. I advise everyone to leave before more Imperial troops arrive.,0.066,0.0,0.934,-0.126,"['attention', 'this', 'is', 'lando', 'calrissian', 'the', 'empire', 'has', 'takes', 'control', 'of', 'the', 'city', 'i', 'advise', 'everyone', 'to', 'leave', 'before', 'more', 'imperial', 'troops', 'arrive']",0.17557251908396945
624,LANDO,This way.,0.0,0.0,1.0,0.0,"['this', 'way']",0.015267175572519083
625,THREEPIO,Don't blame me. I'm an interpreter. I'm not supposed to know  a power socket from a computer terminal.,0.0,0.12,0.88,0.2584,"['do', 'blame', 'me', 'i', 'an', 'interpreter', 'i', 'not', 'supposed', 'to', 'know', 'a', 'power', 'socket', 'from', 'a', 'computer', 'terminal']",0.13740458015267176
626,THREEPIO,"What are you talking about? We're not interested in the  hyperdrive on the Millennium Falcon. It's fixed! Just open the door, you stupid lump.",0.213,0.0,0.787,-0.714,"['what', 'are', 'you', 'talking', 'about', 'we', 'not', 'interested', 'in', 'the', 'hyperdrive', 'on', 'the', 'millennium', 'falcon', 'it', 'fixed', 'just', 'open', 'the', 'door', 'you', 'stupid', 'lump']",0.183206106870229
627,THREEPIO,I never doubted you for a second. Wonderful!,0.0,0.592,0.408,0.7009,"['i', 'never', 'doubted', 'you', 'for', 'a', 'second', 'wonderful']",0.061068702290076333
628,THREEPIO,"Ouch! Oh! Ah! That hurt, Bend down, you thoughtless...Ow!",0.363,0.0,0.637,-0.6776,"['ouch', 'oh', 'ah', 'that', 'hurt', 'bend', 'down', 'you', 'thoughtless', 'ow']",0.07633587786259542
629,LANDO,Leia! Go!,0.0,0.0,1.0,0.0,"['leia', 'go']",0.015267175572519083
630,THREEPIO,"I thought that hairy beast would be the end of me. Of  course, I've looked better.",0.0,0.172,0.828,0.4404,"['i', 'thought', 'that', 'hairy', 'beast', 'would', 'be', 'the', 'end', 'of', 'me', 'of', 'course', 'i', 'looked', 'better']",0.12213740458015267
631,VADER,You are beaten. It is useless to resist. Don't let yourself be  destroyed as Obi-Wan did.,0.404,0.0,0.596,-0.8316,"['you', 'are', 'beaten', 'it', 'is', 'useless', 'to', 'resist', 'do', 'let', 'yourself', 'be', 'destroyed', 'as', 'did']",0.11450381679389313
632,VADER,"There is no escape. Don't make me destroy you. You do not yet  realize your importance. You have only begun to discover you power. Join me and I will complete your training. With our combined strength, we can end this destructive conflict and bring order to the galaxy.",0.152,0.205,0.643,0.296,"['there', 'is', 'no', 'escape', 'do', 'make', 'me', 'destroy', 'you', 'you', 'do', 'not', 'yet', 'realize', 'your', 'importance', 'you', 'have', 'only', 'begun', 'to', 'discover', 'you', 'power', 'join', 'me', 'and', 'i', 'will', 'complete', 'your', 'training', 'with', 'our', 'combined', 'strength', 'we', 'can', 'end', 'this', 'destructive', 'conflict', 'and', 'bring', 'order', 'to', 'the', 'galaxy']",0.366412213740458
633,LUKE,I'll never join you!,0.421,0.0,0.579,-0.2914,"['i', 'never', 'join', 'you']",0.030534351145038167
634,VADER,If you only knew the power of the dark side. Obi-Wan never told  you what happened to your father.,0.0,0.0,1.0,0.0,"['if', 'you', 'only', 'knew', 'the', 'power', 'of', 'the', 'dark', 'side', 'never', 'told', 'you', 'what', 'happened', 'to', 'your', 'father']",0.13740458015267176
635,LUKE,He told me enough! He told me you killed him.,0.347,0.0,0.653,-0.6996,"['he', 'told', 'me', 'enough', 'he', 'told', 'me', 'you', 'killed', 'him']",0.07633587786259542
636,VADER,No. I am your father.,0.423,0.0,0.577,-0.296,"['no', 'i', 'am', 'your', 'father']",0.03816793893129771
637,LUKE,No. No. That's not true! That's impossible!,0.647,0.0,0.353,-0.7443,"['no', 'no', 'that', 'not', 'true', 'that', 'impossible']",0.05343511450381679
638,VADER,Search your feelings. You know it to be true.,0.0,0.259,0.741,0.4215,"['search', 'your', 'feelings', 'you', 'know', 'it', 'to', 'be', 'true']",0.06870229007633588
639,LUKE,No! No! No!,1.0,0.0,0.0,-0.7562,"['no', 'no', 'no']",0.022900763358778626
640,VADER,"Luke. You can destroy the Emperor. He has foreseen this. It is  your destiny. Join me, and we can rule the galaxy as father and son. Come with me. It's the only way.",0.095,0.06,0.845,-0.3182,"['luke', 'you', 'can', 'destroy', 'the', 'emperor', 'he', 'has', 'foreseen', 'this', 'it', 'is', 'your', 'destiny', 'join', 'me', 'and', 'we', 'can', 'rule', 'the', 'galaxy', 'as', 'father', 'and', 'son', 'come', 'with', 'me', 'it', 'the', 'only', 'way']",0.25190839694656486
641,LUKE,"Ben...Ben, please!",0.0,0.722,0.278,0.3802,"['ben', 'ben', 'please']",0.022900763358778626
642,LUKE,Ben. Leia!,0.0,0.0,1.0,0.0,"['ben', 'leia']",0.015267175572519083
643,LUKE,Hear me! Leia!,0.0,0.0,1.0,0.0,"['hear', 'me', 'leia']",0.022900763358778626
644,LEIA,Luke...We've got to go back.,0.0,0.0,1.0,0.0,"['luke', 'we', 'got', 'to', 'go', 'back']",0.04580152671755725
646,LEIA,I know where Luke is.,0.0,0.0,1.0,0.0,"['i', 'know', 'where', 'luke', 'is']",0.03816793893129771
647,LANDO,But what about those fighter?,0.0,0.322,0.678,0.2263,"['but', 'what', 'about', 'those', 'fighter']",0.03816793893129771
648,LEIA,"Chewie, just do it.",0.0,0.0,1.0,0.0,"['chewie', 'just', 'do', 'it']",0.030534351145038167
649,LANDO,But what about Vader?,0.0,0.0,1.0,0.0,"['but', 'what', 'about', 'vader']",0.030534351145038167
650,LANDO,"All right, all right, all right.",0.0,0.0,1.0,0.0,"['all', 'right', 'all', 'right', 'all', 'right']",0.04580152671755725
651,VADER,Bring my shuttle.,0.0,0.0,1.0,0.0,"['bring', 'my', 'shuttle']",0.022900763358778626
652,LANDO,"Look, someone's up there.",0.0,0.0,1.0,0.0,"['look', 'someone', 'up', 'there']",0.030534351145038167
653,LEIA,"It's Luke. Chewie, slow down. Slow down and we'll get under him.  Lando, open the top hatch.",0.0,0.101,0.899,0.2023,"['it', 'luke', 'chewie', 'slow', 'down', 'slow', 'down', 'and', 'we', 'get', 'under', 'him', 'lando', 'open', 'the', 'top', 'hatch']",0.1297709923664122
654,LEIA,"Okay. Easy, Chewie.",0.0,0.828,0.172,0.5859,"['okay', 'easy', 'chewie']",0.022900763358778626
656,LANDO,"Okay, let's go.",0.0,0.487,0.513,0.2263,"['okay', 'let', 'go']",0.022900763358778626
657,LUKE,"Oh, Leia.",0.0,0.0,1.0,0.0,"['oh', 'leia']",0.015267175572519083
658,LANDO,"All right, Chewie. Let's go.",0.0,0.0,1.0,0.0,"['all', 'right', 'chewie', 'let', 'go']",0.03816793893129771
659,LEIA,I'll be back.,0.0,0.0,1.0,0.0,"['i', 'be', 'back']",0.022900763358778626
660,LEIA,Star Destroyer.,0.75,0.0,0.25,-0.4588,"['star', 'destroyer']",0.015267175572519083
661,LANDO,"All right, Chewie. Ready for light-speed.",0.0,0.333,0.667,0.3612,"['all', 'right', 'chewie', 'ready', 'for']",0.03816793893129771
662,LEIA,If your people fixed the hyperdrive.,0.0,0.0,1.0,0.0,"['if', 'your', 'people', 'fixed', 'the', 'hyperdrive']",0.04580152671755725
663,LEIA,All the coordinates are set. It's now or never.,0.0,0.0,1.0,0.0,"['all', 'the', 'coordinates', 'are', 'set', 'it', 'now', 'or', 'never']",0.06870229007633588
664,LANDO,Punch it!,0.0,0.0,1.0,0.0,"['punch', 'it']",0.015267175572519083
665,LANDO,They told me they fixed it. I trusted them to fix it. It's not  my fault!,0.0,0.303,0.697,0.6858,"['they', 'told', 'me', 'they', 'fixed', 'it', 'i', 'trusted', 'them', 'to', 'fix', 'it', 'it', 'not', 'my', 'fault']",0.12213740458015267
666,VADER,Did your men deactivate the hyperdrive on the Millennium  Falcon?,0.0,0.0,1.0,0.0,"['did', 'your', 'men', 'deactivate', 'the', 'hyperdrive', 'on', 'the', 'millennium', 'falcon']",0.07633587786259542
667,VADER,Good. Prepare the boarding party and set for your weapons for  stun.,0.166,0.32,0.514,0.4019,"['good', 'prepare', 'the', 'boarding', 'party', 'and', 'set', 'for', 'your', 'weapons', 'for', 'stun']",0.0916030534351145
668,THREEPIO,Noisy brute. Why don't we just go into light-speed?,0.175,0.0,0.825,-0.1779,"['noisy', 'brute', 'why', 'do', 'we', 'just', 'go', 'into']",0.061068702290076333
669,THREEPIO,We can't? How would you know the hyperdrive is deactivated?,0.0,0.0,1.0,0.0,"['we', 'ca', 'how', 'would', 'you', 'know', 'the', 'hyperdrive', 'is', 'deactivated']",0.07633587786259542
670,THREEPIO,"The city's central computer told you? Artoo-Detoo, you know  better than to trust a strange computer. Ouch! Pay attention to what you're doing!",0.114,0.242,0.643,0.6792,"['the', 'city', 'central', 'computer', 'told', 'you', 'you', 'know', 'better', 'than', 'to', 'trust', 'a', 'strange', 'computer', 'ouch', 'pay', 'attention', 'to', 'what', 'you', 'doing']",0.16793893129770993
673,VADER,"Son, come with me.",0.0,0.0,1.0,0.0,"['son', 'come', 'with', 'me']",0.030534351145038167
674,LUKE,"Ben, why didn't you tell me?",0.0,0.0,1.0,0.0,"['ben', 'why', 'did', 'you', 'tell', 'me']",0.04580152671755725
676,LUKE,It's Vader.,0.0,0.0,1.0,0.0,"['it', 'vader']",0.015267175572519083
677,VADER,Luke...it is your destiny.,0.0,0.0,1.0,0.0,"['luke', 'it', 'is', 'your', 'destiny']",0.03816793893129771
678,LUKE,"Ben, why didn't you tell me?",0.0,0.0,1.0,0.0,"['ben', 'why', 'did', 'you', 'tell', 'me']",0.04580152671755725
679,THREEPIO,"Artoo, come back at once! You haven't finished with me yet!  You don't know how to fix the hyperdrive. Chewbacca can do it. I'm standing here in pieces, and you're having delusions of grandeur!",0.0,0.115,0.885,0.6458,"['artoo', 'come', 'back', 'at', 'once', 'you', 'have', 'finished', 'with', 'me', 'yet', 'you', 'do', 'know', 'how', 'to', 'fix', 'the', 'hyperdrive', 'chewbacca', 'can', 'do', 'it', 'i', 'standing', 'here', 'in', 'pieces', 'and', 'you', 'having', 'delusions', 'of', 'grandeur']",0.2595419847328244
680,THREEPIO,"Oh, you did it!",0.0,0.0,1.0,0.0,"['oh', 'you', 'did', 'it']",0.030534351145038167
681,LANDO,"Luke, we're ready for takeoff.",0.0,0.385,0.615,0.3612,"['luke', 'we', 'ready', 'for', 'takeoff']",0.03816793893129771
682,LUKE,"Good luck, Lando",0.0,0.855,0.145,0.7096,"['good', 'luck', 'lando']",0.022900763358778626
683,LANDO,"When we find Jabba the Hut and that bounty  hunter, we'll contact you.",0.0,0.0,1.0,0.0,"['when', 'we', 'find', 'jabba', 'the', 'hut', 'and', 'that', 'bounty', 'hunter', 'we', 'contact', 'you']",0.09923664122137404
684,LUKE,I'll meet you at the rendezvous point on  Tatooine.,0.0,0.0,1.0,0.0,"['i', 'meet', 'you', 'at', 'the', 'rendezvous', 'point', 'on', 'tatooine']",0.06870229007633588
685,LANDO,"Princess, we'll find Han. I promise.",0.0,0.365,0.635,0.3182,"['princess', 'we', 'find', 'han', 'i', 'promise']",0.04580152671755725
686,LUKE,"Chewie, I'll be waiting for your signal.",0.0,0.0,1.0,0.0,"['chewie', 'i', 'be', 'waiting', 'for', 'your', 'signal']",0.05343511450381679
687,LUKE,"Take care, you two. May the Force be with you.",0.0,0.262,0.738,0.4939,"['take', 'care', 'you', 'two', 'may', 'the', 'force', 'be', 'with', 'you']",0.07633587786259542
689,THREEPIO,Did you hear that?  They've shut down the main reactor.  We'll be destroyed for sure.  This is madness!,0.27,0.097,0.633,-0.6239,"['did', 'you', 'hear', 'that', 'they', 'shut', 'down', 'the', 'main', 'reactor', 'we', 'be', 'destroyed', 'for', 'sure', 'this', 'is', 'madness']",0.13740458015267176
690,THREEPIO,We're doomed!,0.818,0.0,0.182,-0.6696,"['we', 'doomed']",0.015267175572519083
691,THREEPIO,There'll be no escape for the Princess this time.,0.202,0.156,0.642,-0.128,"['there', 'be', 'no', 'escape', 'for', 'the', 'princess', 'this', 'time']",0.06870229007633588
692,THREEPIO,What's that?,0.0,0.0,1.0,0.0,"['what', 'that']",0.015267175572519083
693,THREEPIO,I should have known better than to trust the logic of a half-sized thermocapsulary dehousing assister...,0.0,0.341,0.659,0.7351,"['i', 'should', 'have', 'known', 'better', 'than', 'to', 'trust', 'the', 'logic', 'of', 'a', 'thermocapsulary', 'dehousing', 'assister']",0.11450381679389313
694,LUKE,Hurry up!  Come with me!  What are you waiting for?!  Get in gear!,0.0,0.0,1.0,0.0,"['hurry', 'up', 'come', 'with', 'me', 'what', 'are', 'you', 'waiting', 'for', 'get', 'in', 'gear']",0.09923664122137404
695,THREEPIO,"Artoo! Artoo-Detoo, where are you?",0.0,0.0,1.0,0.0,"['artoo', 'where', 'are', 'you']",0.030534351145038167
696,THREEPIO,At last!  Where have you been?,0.0,0.0,1.0,0.0,"['at', 'last', 'where', 'have', 'you', 'been']",0.04580152671755725
697,THREEPIO,They're heading in this direction. What are we going to do?  We'll be sent to the spice mines of Kessel or smashed into who knows what!,0.0,0.0,1.0,0.0,"['they', 'heading', 'in', 'this', 'direction', 'what', 'are', 'we', 'going', 'to', 'do', 'we', 'be', 'sent', 'to', 'the', 'spice', 'mines', 'of', 'kessel', 'or', 'smashed', 'into', 'who', 'knows', 'what']",0.1984732824427481
698,THREEPIO,"Wait a minute, where are you going?",0.0,0.0,1.0,0.0,"['wait', 'a', 'minute', 'where', 'are', 'you', 'going']",0.05343511450381679
699,VADER,Where are those transmissions you intercepted?,0.0,0.0,1.0,0.0,"['where', 'are', 'those', 'transmissions', 'you', 'intercepted']",0.04580152671755725
700,VADER,If this is a consular ship... where is the Ambassador?,0.0,0.0,1.0,0.0,"['if', 'this', 'is', 'a', 'consular', 'ship', 'where', 'is', 'the', 'ambassador']",0.07633587786259542
701,VADER,"Commander, tear this ship apart until you've found those plans and bring me the Ambassador.  I want her alive!",0.0,0.208,0.792,0.4926,"['commander', 'tear', 'this', 'ship', 'apart', 'until', 'you', 'found', 'those', 'plans', 'and', 'bring', 'me', 'the', 'ambassador', 'i', 'want', 'her', 'alive']",0.1450381679389313
702,THREEPIO,"Hey, you're not permitted in there.  It's restricted. You'll be deactivated for sure..",0.178,0.0,0.822,-0.3818,"['hey', 'you', 'not', 'permitted', 'in', 'there', 'it', 'restricted', 'you', 'be', 'deactivated', 'for']",0.0916030534351145
703,THREEPIO,"Don't call me a mindless philosopher, you overweight glob of grease!  Now come out before somebody sees you.",0.138,0.119,0.743,-0.0992,"['do', 'call', 'me', 'a', 'mindless', 'philosopher', 'you', 'overweight', 'glob', 'of', 'grease', 'now', 'come', 'out', 'before', 'somebody', 'sees', 'you']",0.13740458015267176
704,THREEPIO,Secret mission?  What plans?  What are you talking about?  I'm not getting in there!,0.0,0.0,1.0,0.0,"['secret', 'mission', 'what', 'plans', 'what', 'are', 'you', 'talking', 'about', 'i', 'not', 'getting', 'in', 'there']",0.10687022900763359
705,THREEPIO,I'm going to regret this.,0.412,0.0,0.588,-0.4215,"['i', 'going', 'to', 'regret', 'this']",0.03816793893129771
706,THREEPIO,"That's funny, the damage doesn't look as bad from out here.",0.189,0.339,0.472,0.3716,"['that', 'funny', 'the', 'damage', 'does', 'look', 'as', 'bad', 'from', 'out', 'here']",0.08396946564885496
707,THREEPIO,Are you sure this things safe?,0.0,0.565,0.435,0.6369,"['are', 'you', 'sure', 'this', 'things', 'safe']",0.04580152671755725
708,LUKE,Shape it up you guys!...  Biggs?,0.0,0.0,1.0,0.0,"['shape', 'it', 'up', 'you', 'guys', 'biggs']",0.04580152671755725
709,LUKE,I didn't know you were back!  When did you get in?,0.0,0.0,1.0,0.0,"['i', 'did', 'know', 'you', 'were', 'back', 'when', 'did', 'you', 'get', 'in']",0.08396946564885496
710,LUKE,"The Academy didn't change you much... but you're back so soon?  Hey, what happened, didn't you get your commission?",0.0,0.0,1.0,0.0,"['the', 'academy', 'did', 'change', 'you', 'much', 'but', 'you', 'back', 'so', 'soon', 'hey', 'what', 'happened', 'did', 'you', 'get', 'your', 'commission']",0.1450381679389313
711,LUKE,I almost forgot.  There's a battle going on!  Right here in our system.  Come and look!,0.183,0.0,0.817,-0.4442,"['i', 'almost', 'forgot', 'there', 'a', 'battle', 'going', 'on', 'right', 'here', 'in', 'our', 'system', 'come', 'and', 'look']",0.12213740458015267
712,LUKE,There they are!,0.0,0.0,1.0,0.0,"['there', 'they', 'are']",0.022900763358778626
713,LUKE,But there was a lot of firing earlier...,0.341,0.0,0.659,-0.4767,"['but', 'there', 'was', 'a', 'lot', 'of', 'firing', 'earlier']",0.061068702290076333
714,LUKE,"Hey, easy with those...",0.0,0.492,0.508,0.4404,"['hey', 'easy', 'with', 'those']",0.030534351145038167
715,LEIA,"Lord Vader, I should have known.  Only you could be so bold.  The Imperial Senate will not sit stillfor this, when they hear you've attacked a diplomatic...",0.102,0.115,0.783,0.0941,"['lord', 'vader', 'i', 'should', 'have', 'known', 'only', 'you', 'could', 'be', 'so', 'bold', 'the', 'imperial', 'senate', 'will', 'not', 'sit', 'stillfor', 'this', 'when', 'they', 'hear', 'you', 'attacked', 'a', 'diplomatic']",0.20610687022900764
716,VADER,"Don't play games with me, Your Highness.  You weren't on any mercy mission this time.  You passed directly through a restricted system.  Several transmissions were beamed to this ship by Rebel spies.  I want to know what happened to the plans they sent you.",0.179,0.028,0.793,-0.7224,"['do', 'play', 'games', 'with', 'me', 'your', 'highness', 'you', 'were', 'on', 'any', 'mercy', 'mission', 'this', 'time', 'you', 'passed', 'directly', 'through', 'a', 'restricted', 'system', 'several', 'transmissions', 'were', 'beamed', 'to', 'this', 'ship', 'by', 'rebel', 'spies', 'i', 'want', 'to', 'know', 'what', 'happened', 'to', 'the', 'plans', 'they', 'sent', 'you']",0.33587786259541985
717,LEIA,I don't know what you're talking about.  I'm a member of the Imperial Senate on a diplomatic mission to Alderaan...,0.0,0.0,1.0,0.0,"['i', 'do', 'know', 'what', 'you', 'talking', 'about', 'i', 'a', 'member', 'of', 'the', 'imperial', 'senate', 'on', 'a', 'diplomatic', 'mission', 'to', 'alderaan']",0.15267175572519084
718,VADER,You're a part of the Rebel Alliance... and a traitor.  Take her away!,0.159,0.0,0.841,-0.2244,"['you', 'a', 'part', 'of', 'the', 'rebel', 'alliance', 'and', 'a', 'traitor', 'take', 'her', 'away']",0.09923664122137404
719,VADER,I have traced the Rebel spies to her.  Now she is my only link to find their secret base!,0.1,0.0,0.9,-0.2244,"['i', 'have', 'traced', 'the', 'rebel', 'spies', 'to', 'her', 'now', 'she', 'is', 'my', 'only', 'link', 'to', 'find', 'their', 'secret', 'base']",0.1450381679389313
720,VADER,Leave that to me.  Send a distress signal and then inform the senate that all aboard were killed!,0.4,0.047,0.553,-0.8516,"['leave', 'that', 'to', 'me', 'send', 'a', 'distress', 'signal', 'and', 'then', 'inform', 'the', 'senate', 'that', 'all', 'aboard', 'were', 'killed']",0.13740458015267176
721,VADER,"She must have hidden the plans in the escape pod.  Send a detachment down to retrieve them.  See to it personally, Commander.  There'll be no one to stop us this time.",0.133,0.051,0.816,-0.4019,"['she', 'must', 'have', 'hidden', 'the', 'plans', 'in', 'the', 'escape', 'pod', 'send', 'a', 'detachment', 'down', 'to', 'retrieve', 'them', 'see', 'to', 'it', 'personally', 'commander', 'there', 'be', 'no', 'one', 'to', 'stop', 'us', 'this', 'time']",0.2366412213740458
722,THREEPIO,How did I get into this mess?  I really don't know how.  We seem to be made to suffer.  It's our lot in life.,0.242,0.0,0.758,-0.7488,"['how', 'did', 'i', 'get', 'into', 'this', 'mess', 'i', 'really', 'do', 'know', 'how', 'we', 'seem', 'to', 'be', 'made', 'to', 'suffer', 'it', 'our', 'lot', 'in', 'life']",0.183206106870229
723,THREEPIO,I've got to rest before I fall apart.  My joints are almost frozen. ,0.0,0.0,1.0,0.0,"['i', 'got', 'to', 'rest', 'before', 'i', 'fall', 'apart', 'my', 'joints', 'are', 'almost', 'frozen']",0.09923664122137404
724,THREEPIO,What a desolate place this is.,0.0,0.0,1.0,0.0,"['what', 'a', 'desolate', 'place', 'this', 'is']",0.04580152671755725
725,THREEPIO,Where are you going?,0.0,0.0,1.0,0.0,"['where', 'are', 'you', 'going']",0.030534351145038167
726,THREEPIO,"Well, I'm not going that way.  It's much too rocky.  This way is much easier.",0.0,0.274,0.726,0.5994,"['well', 'i', 'not', 'going', 'that', 'way', 'it', 'much', 'too', 'rocky', 'this', 'way', 'is', 'much', 'easier']",0.11450381679389313
727,THREEPIO,What makes you think there are settlements over there?,0.0,0.0,1.0,0.0,"['what', 'makes', 'you', 'think', 'there', 'are', 'settlements', 'over', 'there']",0.06870229007633588
728,THREEPIO,Don't get technical with me.,0.0,0.0,1.0,0.0,"['do', 'get', 'technical', 'with', 'me']",0.03816793893129771
